{
  "$schema":"https://json-schema.org/draft/2020-12/schema","type":"object","additionalProperties":false,"required":["schema_version","dataset_sha256","sources","predictions"],
  "properties":{"schema_version":{"const":2},"dataset_sha256":{"type":"string","pattern":"^[0-9a-f]{64}$"},"sources":{"type":"object","propertyNames":{"$ref":"#/$defs/label"},"additionalProperties":{"$ref":"#/$defs/source"}},"predictions":{"type":"array","items":{"$ref":"#/$defs/prediction"}}},
  "$defs":{"label":{"type":"string","pattern":".*\\S.*"},"number":{"type":"number","minimum":0,"maximum":1},"opaque":{"type":"object"},"source":{"oneOf":[{"type":"object","additionalProperties":false,"required":["kind","model","configuration"],"properties":{"kind":{"const":"classifier"},"model":{"$ref":"#/$defs/label"},"configuration":{"$ref":"#/$defs/opaque"},"question_id":{"$ref":"#/$defs/label"},"evidence":{"type":"array","items":{"$ref":"#/$defs/label"}},"observation_definitions":{"type":"object","propertyNames":{"$ref":"#/$defs/label"},"additionalProperties":{"$ref":"#/$defs/observation_definition"}},"preparation":{"$ref":"#/$defs/preparation"}}},{"type":"object","additionalProperties":false,"required":["kind","model","configuration","question_id"],"properties":{"kind":{"const":"scored_choice"},"model":{"$ref":"#/$defs/label"},"configuration":{"$ref":"#/$defs/opaque"},"question_id":{"$ref":"#/$defs/label"},"evidence":{"type":"array","items":{"$ref":"#/$defs/label"}},"observation_definitions":{"type":"object","propertyNames":{"$ref":"#/$defs/label"},"additionalProperties":{"$ref":"#/$defs/observation_definition"}},"preparation":{"$ref":"#/$defs/preparation"}}}]},"preparation":{"type":"object","additionalProperties":false,"required":["method","version","configuration","evidence_indices"],"properties":{"method":{"$ref":"#/$defs/label"},"version":{"$ref":"#/$defs/label"},"configuration":{"$ref":"#/$defs/opaque"},"evidence_indices":{"type":"array","minItems":1,"uniqueItems":true,"items":{"type":"integer","minimum":0}}}},"observation_definition":{"type":"object","additionalProperties":false,"required":["kind","description"],"properties":{"kind":{"enum":["scalar","bernoulli","reported_confidence","categorical","label_marginals"]},"description":{"$ref":"#/$defs/label"},"question_id":{"$ref":"#/$defs/label"}}},"outcome":{"oneOf":[{"type":"object","additionalProperties":false,"required":["type","label"],"properties":{"type":{"const":"class"},"label":{"$ref":"#/$defs/label"}}},{"type":"object","additionalProperties":false,"required":["type","labels"],"properties":{"type":{"const":"labels"},"labels":{"type":"array","uniqueItems":true,"items":{"$ref":"#/$defs/label"}}}},{"type":"object","additionalProperties":false,"required":["type"],"properties":{"type":{"const":"abstention"},"reason":{"$ref":"#/$defs/label"}}}]},"probability":{"oneOf":[{"type":"object","additionalProperties":false,"required":["kind","values"],"properties":{"kind":{"const":"categorical"},"values":{"type":"object","minProperties":1,"propertyNames":{"$ref":"#/$defs/label"},"additionalProperties":{"$ref":"#/$defs/number"}}}},{"type":"object","additionalProperties":false,"required":["kind","values"],"properties":{"kind":{"const":"label_marginals"},"values":{"type":"object","minProperties":1,"propertyNames":{"$ref":"#/$defs/label"},"additionalProperties":{"$ref":"#/$defs/number"}}}}]},"observation":{"oneOf":[{"type":"object","additionalProperties":false,"required":["kind","value"],"properties":{"kind":{"const":"scalar"},"value":{"type":"number"}}},{"type":"object","additionalProperties":false,"required":["kind","value"],"properties":{"kind":{"enum":["bernoulli","reported_confidence"]},"value":{"$ref":"#/$defs/number"}}},{"type":"object","additionalProperties":false,"required":["kind","values"],"properties":{"kind":{"enum":["categorical","label_marginals"]},"values":{"type":"object","minProperties":1,"propertyNames":{"$ref":"#/$defs/label"},"additionalProperties":{"$ref":"#/$defs/number"}}}}]},"prediction":{"type":"object","additionalProperties":false,"required":["id","source_id","outcome"],"properties":{"id":{"type":"string","format":"uuid"},"source_id":{"$ref":"#/$defs/label"},"outcome":{"$ref":"#/$defs/outcome"},"probabilities":{"$ref":"#/$defs/probability"},"confidence":{"$ref":"#/$defs/number"},"observations":{"type":"object","propertyNames":{"$ref":"#/$defs/label"},"additionalProperties":{"$ref":"#/$defs/observation"}}}}}
}
