{
  "schema_version": 2,
  "dataset_sha256": "36a22398a40ed88cc81112bfcf009c6cf3c0cbfa0d041278e048ea634975d885",
  "sources": {
    "candidate": {
      "kind": "classifier",
      "model": "synthetic-multi-label",
      "configuration": {"revision": "candidate-v2"}
    }
  },
  "predictions": [
    {
      "id": "01995c20-7d00-7000-8000-000000000001",
      "source_id": "candidate",
      "outcome": {"type": "labels", "labels": ["A", "B"]},
      "probabilities": {"kind": "label_marginals", "values": {"A": 0.8, "B": 0.8, "C": 0.2}}
    },
    {
      "id": "01995c20-7d00-7000-8000-000000000002",
      "source_id": "candidate",
      "outcome": {"type": "abstention", "reason": "manual-review"},
      "probabilities": {"kind": "label_marginals", "values": {"A": 0.2, "B": 0.2, "C": 0.2}}
    }
  ]
}
