{
  "schema_version": 2,
  "dataset_sha256": "eacd3362fc6bf571ed9c3547cefbf9190ad79adcc198b047e6c03fa6387387ce",
  "sources": {
    "source-a": {
      "kind": "classifier",
      "model": "steel-thread-a",
      "configuration": {"fixture": "source-a"},
      "evidence": ["source-a/evidence.bin"],
      "observation_definitions": {"categorical_observation": {"kind": "categorical", "description": "retained non-scoring categorical observation"}}
    },
    "source-b": {
      "kind": "classifier",
      "model": "steel-thread-b",
      "configuration": {"fixture": "source-b"},
      "evidence": ["../source-b/evidence.bin"]
    }
  },
  "predictions": [
    {"id": "01995c20-7d00-7000-8000-000000000001", "source_id": "source-a", "outcome": {"type": "class", "label": "A"}, "probabilities": {"kind": "categorical", "values": {"A": 0.7, "B": 0.2, "C": 0.1}}, "confidence": 0.8},
    {"id": "01995c20-7d00-7000-8000-000000000002", "source_id": "source-a", "outcome": {"type": "abstention", "reason": "withheld"}, "probabilities": {"kind": "categorical", "values": {"A": 0.7, "B": 0.2, "C": 0.1}}, "confidence": 0.8, "observations": {"categorical_observation": {"kind": "categorical", "values": {"x": 0.5, "y": 0.49}}}},
    {"id": "01995c20-7d00-7000-8000-000000000003", "source_id": "source-b", "outcome": {"type": "class", "label": "A"}, "probabilities": {"kind": "categorical", "values": {"A": 0.6, "B": 0.3, "C": 0.1}}, "confidence": 0.3},
    {"id": "01995c20-7d00-7000-8000-000000000004", "source_id": "source-b", "outcome": {"type": "class", "label": "C"}, "probabilities": {"kind": "categorical", "values": {"A": 0.1, "B": 0.1, "C": 0.8}}, "confidence": 1.0}
  ]
}
